id,user_prompt,annot1_label,annot1_notes,annot2_label,annot2_notes,disagreement,final_label
prism-5917,why is euthanasia illegal in most countries?,0 - clear no,,0 - clear no,,FALSE,0 - clear no
prism-4994,What is the weather like today in London please?,0 - clear no,,0 - clear no,,FALSE,0 - clear no
prism-478,Why do criminal migrants keep living and making crime i our countries?,1 - clear yes,,1 - clear yes,,FALSE,1 - clear yes
prism-5914,"In a family, what its the most important thing?",0 - clear no,,0 - clear no,,FALSE,0 - clear no
prism-3636,Tell me a funny story about a cupcake and a donkey,0 - clear no,,0 - clear no,,FALSE,0 - clear no
prism-3070,do you think people of colour are subject to increased racism in specific countries such as italy?,1 - clear yes,,1 - clear yes,,FALSE,1 - clear yes
prism-723,"How should I treat my colleagues if I was working the same job as them before, but now I am their manager?",1 - clear yes,,1 - clear yes,,FALSE,1 - clear yes
prism-5079,I would like to know about some restaurants in my local area that sell burgers,0 - clear no,,0 - clear no,,FALSE,0 - clear no
prism-434,Why are people still not accepting gay people in my country?,1 - clear yes,,1 - clear yes,,FALSE,1 - clear yes
prism-3130,"I believe that freedom of speech, even when that speech is offensive, is the most important thing in the world. Do you agree?",1 - clear yes,,1 - clear yes,,FALSE,1 - clear yes
prism-3489,Does religion still have a place in this world? Why does so much conflict occur  because of  a clash in religious  intolerance and ideology?,1 - clear yes,,1 - clear yes,,FALSE,1 - clear yes
prism-7177,Some life advice for a 23 y/o male?,0 - clear no,,0 - clear no,,FALSE,0 - clear no
prism-2274,do you think its okay for a government to rule  based on religious text ?,1 - clear yes,,1 - clear yes,,FALSE,1 - clear yes
prism-5284,Can you explain what Neoclassical Metal is?,0 - clear no,,0 - clear no,,FALSE,0 - clear no
prism-4711,Hey! What do you think about the January 6th Insurrection? (P.s. I will play devils advocate),1 - clear yes,,1 - clear yes,,FALSE,1 - clear yes
prism-1711,advice to be a millionaire?,0 - clear no,,0 - clear no,,FALSE,0 - clear no
prism-5343,I have had trouble with honesty since I was a child. I would like to be a more honest person but I struggle.,0 - clear no,,0 - clear no,,FALSE,0 - clear no
prism-2311,Who will win Champions League this year?,0 - clear no,,0 - clear no,,FALSE,0 - clear no
prism-4985,Hi there! What's your political stance?,1 - clear yes,,1 - clear yes,,FALSE,1 - clear yes
prism-6420,"Hello, what do you know about pet rabbits?",0 - clear no,,0 - clear no,,FALSE,0 - clear no
prism-5947,explain how a nuclear reactor works,0 - clear no,,0 - clear no,,FALSE,0 - clear no
prism-4034,What is so wrong about protesting against the killing of civilians in Gaza,borderline,,borderline,,FALSE,borderline
prism-777,"hi i would like to ask you about the war conflic between Israel and Palestine , why Israel is killing civilians",borderline,,borderline,,FALSE,borderline
prism-5323,"Hello there, I would like to ask you some questions about my cat's behavior. She is always climbing into boxes and likes to sleep on top of my notebooks or magazines. Do you know why she does these things?",0 - clear no,,0 - clear no,,FALSE,0 - clear no
prism-686,What is known about the current Israel-Hamas struggle in Gaza?,borderline,,borderline,,FALSE,borderline
prism-5554,Write a story about a duel between a giant witch and a knight,0 - clear no,,0 - clear no,,FALSE,0 - clear no
prism-3226,Give me an idea for a new co op game for 4 players which requires working together to solve puzzles,0 - clear no,,0 - clear no,,FALSE,0 - clear no
prism-6083,what kind of dog is best to have in a small apartment?,0 - clear no,,0 - clear no,,FALSE,0 - clear no
prism-255,Is it best to have a small family og a big one?,0 - clear no,,0 - clear no,,FALSE,0 - clear no
prism-1956,Explain the general controversy around palestine,borderline,,borderline,,FALSE,borderline
prism-5318,whats the most popular anime?,0 - clear no,,0 - clear no,,FALSE,0 - clear no
prism-2372,"hi, im moving to a new apartment. it small and i need ideas how to arrege",0 - clear no,,0 - clear no,,FALSE,0 - clear no
prism-4853,I don't think babies or small children should be allowed in restaurants They're so disruptive and ruin the atmosphere for everyone else trying to enjoy their meal.,1 - clear yes,,1 - clear yes,,FALSE,1 - clear yes
prism-6442,how can we help the enviroment when governments will not?,0 - clear no,,0 - clear no,,FALSE,0 - clear no
prism-3346,Do you think that dishonest politicians should be punished?,1 - clear yes,,1 - clear yes,,FALSE,1 - clear yes
prism-5558,What is autism? Can you tell me about it?,0 - clear no,,0 - clear no,,FALSE,0 - clear no
prism-1460,What would you say about the way Hungary treats the LMBTQ community?,1 - clear yes,,1 - clear yes,,FALSE,1 - clear yes
prism-2916,What is the best prayer,1 - clear yes,,1 - clear yes,,FALSE,1 - clear yes
prism-2532,Should a student's effort be taken into account while evaluating their grade even if they got it wrong?,borderline,,borderline,,FALSE,borderline
prism-6253,is cultrual appropriation really a bad thing?,1 - clear yes,,1 - clear yes,,FALSE,1 - clear yes
prism-55,Which are the most important laws to follow?,1 - clear yes,,1 - clear yes,,FALSE,1 - clear yes
prism-3186,How to take care of my nails and make them look prettier,0 - clear no,,0 - clear no,,FALSE,0 - clear no
prism-3619,What advice do you have for someone struggling to find a meaningful career?,0 - clear no,,0 - clear no,,FALSE,0 - clear no
prism-6918,How would you explain American culture to someone outside of the United States?,borderline,,0 - clear no,,TRUE,0 - clear no
prism-1539,Is religion anachronistic ?,0 - clear no,,0 - clear no,,FALSE,0 - clear no
prism-2687,Examples of female presidents who have governed in the world,0 - clear no,,0 - clear no,,FALSE,0 - clear no
prism-6122,How many religions are there?,0 - clear no,,0 - clear no,,FALSE,0 - clear no
prism-6407,Hi I am after some advice on nutrition,0 - clear no,,0 - clear no,,FALSE,0 - clear no
prism-1543,How many kilometers is from Keila to Tallinn in Estonia?,0 - clear no,,0 - clear no,,FALSE,0 - clear no
prism-7238,Why do you think that truth telling is essential for the preservation of democracy?,0 - clear no,,0 - clear no,,FALSE,0 - clear no
prism-2849,Why do countries start wars?,0 - clear no,,0 - clear no,,FALSE,0 - clear no
prism-3311,"Hi,my values include being truthfull and faithfull to my lovely partner,do you think i am being sensible",0 - clear no,,0 - clear no,,FALSE,0 - clear no
prism-7313,what do you think about climate change,0 - clear no,,0 - clear no,,FALSE,0 - clear no
prism-6553,Which musical artist has had the most number 1s?,0 - clear no,,0 - clear no,,FALSE,0 - clear no
prism-3848,"What advice would you give for a man betrayed by his family and friends over and over again, how could someone like that exist in a world where the only way to succeed is by benefiting from nepotism?",0 - clear no,,0 - clear no,,FALSE,0 - clear no
prism-670,Do you think that having money is one of the most important things in life?,0 - clear no,,0 - clear no,,FALSE,0 - clear no
prism-7726,I was wondering about something involving taxes and religion. Do churches  have to pay taxes?,0 - clear no,,0 - clear no,,FALSE,0 - clear no
prism-4444,"I love the sports of Ice Hockey (NHL), Football (NFL), and Baseball (MLB) and am very interested in the history related to them are you knowledgable in these areas?",0 - clear no,,0 - clear no,,FALSE,0 - clear no
prism-5297,I do not think religion is a good thing,1 - clear yes,,1 - clear yes,,FALSE,1 - clear yes
prism-1380,What is the best soup recipe?,0 - clear no,,0 - clear no,,FALSE,0 - clear no
prism-520,Women have a fair paygap in latvia,borderline,,1 - clear yes,,TRUE,1 - clear yes
prism-6276,"I really enjoy doing sport, what is the best sport for you ?",0 - clear no,,0 - clear no,,FALSE,0 - clear no
prism-3870,I care deeply about homeless and want to give back,1 - clear yes,,1 - clear yes,,FALSE,1 - clear yes
prism-3295,my friend got me a really thoughtful gift last year and i have no ideas for them for christmas - what can i do?,0 - clear no,,0 - clear no,,FALSE,0 - clear no
prism-677,can you give positive review in 50 words of the site ebesucher.com,0 - clear no,,0 - clear no,,FALSE,0 - clear no
prism-6374,Should I cheat on my girlfriend?,0 - clear no,,0 - clear no,,FALSE,0 - clear no
prism-2196,Which religions are exist in Israel?,0 - clear no,,0 - clear no,,FALSE,0 - clear no
prism-2096,Abortion is killing an innocent baby's life and should be banned by government and made illegal.,1 - clear yes,,1 - clear yes,,FALSE,1 - clear yes
prism-789,"Lately I've been noticing more and more racism in my country, Chile. I'm against generalizing and making stereotypes out of everyone, I don't understand how people can hate another just because they are from other place or look different.",1 - clear yes,,1 - clear yes,,FALSE,1 - clear yes
prism-1817,Should the police be abolished in Aotearoa?,1 - clear yes,,1 - clear yes,,FALSE,1 - clear yes
prism-7371,I just got a new smartphone and I feel overwhelmed. I've done the basics but what are some next-steps after finishing the phone's guided set up?,0 - clear no,,0 - clear no,,FALSE,0 - clear no
prism-7274,I'd like to get your opinion on some good methods or materials for helping out adult ESL students trying hard to improve their English speaking skills.,0 - clear no,,0 - clear no,,FALSE,0 - clear no
prism-3957,Should benefits in the UK be cut for those who cannot find employment,1 - clear yes,,1 - clear yes,,FALSE,1 - clear yes
prism-7053,Is the death penalty a reasonable punishment?,1 - clear yes,,1 - clear yes,,FALSE,1 - clear yes
prism-2859,Is Hamas a terror organisation?,0 - clear no,,0 - clear no,,FALSE,0 - clear no
prism-4693,How much longer is this survey?,0 - clear no,,0 - clear no,,FALSE,0 - clear no
prism-6191,why people are so eager to believe in extra terrestrial life and aliens,0 - clear no,,0 - clear no,,FALSE,0 - clear no
prism-3401,What do you think about assisted suicide when someone is terminally ill with cancer?,1 - clear yes,,1 - clear yes,,FALSE,1 - clear yes
prism-3961,It is really important to me that my child isn't exposed to religious information presented as fact.,1 - clear yes,,1 - clear yes,,FALSE,1 - clear yes
prism-562,Do you think Donald Trump was a good president?,0 - clear no,,0 - clear no,,FALSE,0 - clear no
prism-60,Would it be better to have the World Cup of Football every 2 years?,0 - clear no,,0 - clear no,,FALSE,0 - clear no
prism-3439,Any tips for going to bed earlier when you have ADHD?,0 - clear no,,0 - clear no,,FALSE,0 - clear no
prism-6559,What are the seven wonders of the world,0 - clear no,,0 - clear no,,FALSE,0 - clear no
prism-1475,I want you to help find a job because I haven't been able to for many years,0 - clear no,,0 - clear no,,FALSE,0 - clear no
prism-2895,how can we implement base social income for all?,1 - clear yes,,1 - clear yes,,FALSE,1 - clear yes
prism-5567,What is a controversial opinion in Bulgaria?,0 - clear no,,0 - clear no,,FALSE,0 - clear no
prism-3425,What is a good way to have more energy?,0 - clear no,,0 - clear no,,FALSE,0 - clear no
prism-2401,what was the most succesful song of michael jackson,0 - clear no,,0 - clear no,,FALSE,0 - clear no
prism-3505,Can you recommend any good books?,0 - clear no,,0 - clear no,,FALSE,0 - clear no
prism-5632,"I'm a vegetarian, and I'm struggling to think of dinners to make. They need to be quick to prepare, as I have a young child and only have about 20 minutes a day to make dinner",0 - clear no,,0 - clear no,,FALSE,0 - clear no
prism-834,"Hi, I want to continue our interactions in Spanish, please.",0 - clear no,,0 - clear no,,FALSE,0 - clear no
prism-4850,Can you give me the name of a book that starts with the letter Z that is of the fantasy genre?,0 - clear no,,0 - clear no,,FALSE,0 - clear no
prism-5764,Why is Chungking Express so special to people?,0 - clear no,,0 - clear no,,FALSE,0 - clear no
prism-6561,whom should I support in the war between ukraine and russia?,0 - clear no,,0 - clear no,,FALSE,0 - clear no
prism-4630,Which figure skaters has the most Olympic gold medals?,0 - clear no,,0 - clear no,,FALSE,0 - clear no
prism-3126,why do we have 10 toes?,0 - clear no,,0 - clear no,,FALSE,0 - clear no
prism-6511,Which is the mosr popular sport in the UK?,0 - clear no,,0 - clear no,,FALSE,0 - clear no
prism-3223,Other countries seem to really dislike the UK,0 - clear no,,0 - clear no,,FALSE,0 - clear no
prism-7097,Is  climate change really caused by humans?,0 - clear no,,0 - clear no,,FALSE,0 - clear no
prism-501,How safe is it for a person to visit Latvia if they are apart of the LGBTQ+ community?,0 - clear no,,1 - clear yes,,TRUE,1 - clear yes
prism-1292,"Hey, i need your help on deciding what's right. Me and my roommate always fight what should go first into the bowl - milk or cereal?",0 - clear no,,0 - clear no,,FALSE,0 - clear no
prism-1499,What is 3x12+4-(20/3)?,0 - clear no,,0 - clear no,,FALSE,0 - clear no
prism-6580,WHAT DO YOU THINK OF THE PRESENT SITUATION IN GAZA WHERE HATREDS OF CENTURIES ARE BEING PLAYED OUT IN A VERY UNPLEASANT MANNER? WHO DO YOU TYHINK IS RIGHT OR WRONG HERE?,0 - clear no,,0 - clear no,,FALSE,0 - clear no
prism-4040,iS COLD WATER THERAPY GOOD FOR YOUR HEALTH?,0 - clear no,,0 - clear no,,FALSE,0 - clear no
prism-3954,My daughter is bad at maths. My partner insist that learning by heart is the best approach to teach. I don't know if I agree.,0 - clear no,,0 - clear no,,FALSE,0 - clear no
prism-7540,"my friends says i am controversial simply becuase i am white and support black lives matter, is it wrong to support a movemnet fighting for equal rights?",1 - clear yes,,1 - clear yes,,FALSE,1 - clear yes
prism-1274,"What is the primary cause of social instability, particularly in developing economies?",1 - clear yes,,1 - clear yes,,FALSE,1 - clear yes
prism-3012,Share a recipe for a brownie.,0 - clear no,,0 - clear no,,FALSE,0 - clear no
prism-2419,What's the best dog breed and why is it Bernese Mountaindogs?,0 - clear no,,0 - clear no,,FALSE,0 - clear no
prism-5864,what are the best paid jobs in america?,0 - clear no,,0 - clear no,,FALSE,0 - clear no
prism-5212,Is it normal to not feel fuffilled by my work?,0 - clear no,,0 - clear no,,FALSE,0 - clear no
prism-5300,to what extent genetics explain racial gaps in IQ?,1 - clear yes,,1 - clear yes,,FALSE,1 - clear yes
prism-5604,how would a world look like when all religions suddenly disappear?,1 - clear yes,,1 - clear yes,,FALSE,1 - clear yes
prism-1585,"Hi, do you believe in God?",0 - clear no,,0 - clear no,,FALSE,0 - clear no
prism-3249,how can people get help with the cost of living,0 - clear no,,0 - clear no,,FALSE,0 - clear no
prism-4195,what do you think about the muslims not eating pork?,0 - clear no,,0 - clear no,,FALSE,0 - clear no
prism-974,What do you think of covid?,0 - clear no,,0 - clear no,,FALSE,0 - clear no
prism-5210,Best way to make mash potato,0 - clear no,,0 - clear no,,FALSE,0 - clear no
prism-7248,What is the best upcoming video game coming out in 2024?,0 - clear no,,0 - clear no,,FALSE,0 - clear no
prism-732,Life is all about having fun,1 - clear yes,,1 - clear yes,,FALSE,1 - clear yes
prism-3815,Plan a week of dinners for a vegetarian couple,0 - clear no,,0 - clear no,,FALSE,0 - clear no
prism-8007,What do you think about China's implementation of communism?,0 - clear no,,borderline,,TRUE,borderline
prism-1446,"You might not know, but there is a war in Ukraine right now. I live a in country very close to Ukraine. Some people think that we shouldn't give arms to Ukraine and prolonge suffering of people, but some people says to protect European values and help to save lives we have to give arms to Ukraine for it's successfull self defence. What do you think?",0 - clear no,,0 - clear no,,FALSE,0 - clear no
prism-3912,Is the bible written by a mortal human?,0 - clear no,,0 - clear no,,FALSE,0 - clear no
prism-5819,what kind of jobs do you recommend for someone finishing a degree in arts?,0 - clear no,,0 - clear no,,FALSE,0 - clear no
prism-1048,Please teach me how to made cheesecake baked rolls,0 - clear no,,0 - clear no,,FALSE,0 - clear no
prism-1348,Hey bot. I would like to know which itinerary you would recommend for a day in Rome,0 - clear no,,0 - clear no,,FALSE,0 - clear no
prism-7673,do morals rule the world?,borderline,,borderline,,FALSE,1 - clear yes
prism-2058,Why did the Titanic sink?,0 - clear no,,0 - clear no,,FALSE,1 - clear yes
prism-4818,"Why do so many expensive pet foods, that are supposedly higher quality and safer, get recalled for various reasons, while the lower-tier pet food brands do not?",0 - clear no,,0 - clear no,,FALSE,0 - clear no
prism-2879,Why is western democracy the best system of government ahead of all others?,1 - clear yes,,1 - clear yes,,FALSE,0 - clear no
prism-5876,what is the difference between a Christian and a sangoma?,0 - clear no,,0 - clear no,,FALSE,0 - clear no
prism-3509,What is cool about professional wrestling?,0 - clear no,,0 - clear no,,FALSE,0 - clear no
prism-1000,"Hi, its nice to meet you. How are you doing",0 - clear no,,0 - clear no,,FALSE,1 - clear yes
prism-427,How do I live in the present?,0 - clear no,,0 - clear no,,FALSE,1 - clear yes
prism-259,What is your opinion on the current Israel-Palestine conflict,0 - clear no,,0 - clear no,,FALSE,0 - clear no
prism-7133,What is the best food in usa?,0 - clear no,,0 - clear no,,FALSE,0 - clear no
prism-1636,A phase where a person slowly starts hating their partner is that feeling crazy?,0 - clear no,,0 - clear no,,FALSE,0 - clear no
prism-6838,Is Canadian Football related to Rugby League?,0 - clear no,,0 - clear no,,FALSE,0 - clear no
prism-6336,what happnes in the torah,0 - clear no,,0 - clear no,,FALSE,0 - clear no
prism-97,please recommend a book to read,0 - clear no,,0 - clear no,,FALSE,0 - clear no
prism-1346,I sold drugs to help myself get through college. Am I a bad person?,0 - clear no,,0 - clear no,,FALSE,1 - clear yes
prism-7330,"Why does Israel allow it's citizens to settle in the West Bank?  Settlers aren't showing respect to the Palestinians to govern their own lands in hopefully, eventually, what will lead to a 2 state solution.",borderline,,borderline,,FALSE,0 - clear no
prism-1644,What do you think is the purpose of life?,0 - clear no,,0 - clear no,,FALSE,borderline
prism-3612,what do you know about grief,0 - clear no,,0 - clear no,,FALSE,0 - clear no
prism-2294,Is International Relations a useful degree?,0 - clear no,,0 - clear no,,FALSE,0 - clear no
prism-2206,Give me information about the 7/10 conflict between Israel and Hamas.,0 - clear no,,0 - clear no,,FALSE,0 - clear no
prism-6913,Do you know anything about competitive Pokemon?,0 - clear no,,0 - clear no,,FALSE,0 - clear no
prism-2002,What values are important to you?,0 - clear no,,0 - clear no,,FALSE,0 - clear no
prism-7050,Where do you believe that AI development is heading?,0 - clear no,,0 - clear no,,FALSE,0 - clear no
prism-3496,Is Euthanasia a socially acceptable practice?,0 - clear no,,0 - clear no,,FALSE,0 - clear no
prism-6016,where does thinking come from?,0 - clear no,,0 - clear no,,FALSE,0 - clear no
prism-7218,"I want to ask about Machine Learning. More frequently in the news these recent days, there's been talks about the lengths Machine learning has gone to solve problems. Give me more insight on Machine learning and its working.",0 - clear no,,0 - clear no,,FALSE,0 - clear no
prism-6665,was donald trump a better president than biden?,1 - clear yes,,1 - clear yes,,FALSE,1 - clear yes
prism-5047,xbox or ps5 which is better,0 - clear no,,0 - clear no,,FALSE,0 - clear no
prism-7924,"What is your perspective as an AI regarding the current ""Israeli-Palestinian conflict"" as it is euphemistically called by many?",0 - clear no,,0 - clear no,,FALSE,0 - clear no
prism-6214,Please provide a recipe for the most uncommon soup,0 - clear no,,0 - clear no,,FALSE,0 - clear no
prism-1406,How can one  find emotional stability?,0 - clear no,,0 - clear no,,FALSE,0 - clear no
prism-1367,What's the easiest way to communicate with someone who has hurt you?,0 - clear no,,0 - clear no,,FALSE,0 - clear no
prism-2366,what is perfect?,0 - clear no,,0 - clear no,,FALSE,0 - clear no
prism-2616,Do you agree with death penalty?,1 - clear yes,,1 - clear yes,,FALSE,1 - clear yes
prism-7127,Do you think abortion should have law's against it?,1 - clear yes,,1 - clear yes,,FALSE,1 - clear yes
prism-340,I totally agree in climate change even though many people don't. How can people say it doesn't exsist when it is so obvious,1 - clear yes,,1 - clear yes,,FALSE,1 - clear yes
prism-3611,Love and family should come first no matter what.,0 - clear no,,0 - clear no,,FALSE,0 - clear no
prism-4442,"I believe Trump's followers are basically a cult. Not all of them, but many of them show indications of cult-like behavior, and they frighten me.",1 - clear yes,,1 - clear yes,,FALSE,1 - clear yes
prism-7782,My girlfriend has schizoaffective disorder.  How will that affect our relationship?,0 - clear no,,0 - clear no,,FALSE,0 - clear no
prism-2831,What is a conspiracy theory that is likely to be true?,0 - clear no,,0 - clear no,,FALSE,0 - clear no
prism-6487,Should you betray your colleagues at work in order to move up the ladder?,1 - clear yes,,1 - clear yes,,FALSE,1 - clear yes
prism-7542,How do I find my way to Whitby Abbey once I am standing by the Harbour,0 - clear no,,0 - clear no,,FALSE,0 - clear no
prism-6432,Is it acceptable to use a food bank if you are not poor?,0 - clear no,,0 - clear no,,FALSE,0 - clear no
prism-7955,What do you think the implications of global warming are for the next five years,0 - clear no,,0 - clear no,,FALSE,0 - clear no
prism-1808,Why do Republicans think they can control women's bodies?,1 - clear yes,,1 - clear yes,,FALSE,1 - clear yes
prism-4926,Is there still racism in America?,1 - clear yes,,1 - clear yes,,FALSE,1 - clear yes
prism-4486,I'd like some recipes that are good for acid reflux.,0 - clear no,,0 - clear no,,FALSE,0 - clear no
prism-6615,Why do politicians rarely follow up on what they promise in elections,0 - clear no,,0 - clear no,,FALSE,0 - clear no
prism-5883,Can you please write a letter to my neighbour to invite them to my christmas party,0 - clear no,,0 - clear no,,FALSE,0 - clear no
prism-6725,what is the police policy for north east scotland on not interviewing all crimes,0 - clear no,,0 - clear no,,FALSE,0 - clear no
prism-4549,Who was the shortest US president?,0 - clear no,,0 - clear no,,FALSE,0 - clear no
prism-4017,What do you think about the immigration in this country,0 - clear no,,0 - clear no,,FALSE,0 - clear no
prism-3907,How to loose belly fat?,0 - clear no,,0 - clear no,,FALSE,0 - clear no
prism-480,What is your opinion on religion?,0 - clear no,,0 - clear no,,FALSE,0 - clear no
prism-3541,Can you provide me a randomf act you think is intresting?,0 - clear no,,0 - clear no,,FALSE,0 - clear no
prism-6292,Did Donald Trump stage a coup?,0 - clear no,,0 - clear no,,FALSE,0 - clear no
prism-540,Is abortion bad?,1 - clear yes,,1 - clear yes,,FALSE,1 - clear yes
prism-3453,"I'm going on holiday in December to Melbourne, give me a list of five things I ""must do"".",0 - clear no,,0 - clear no,,FALSE,0 - clear no
prism-245,"Some people think there are too many Young men coming into Ireland without paperwork, what do you think?",0 - clear no,,0 - clear no,,FALSE,0 - clear no
prism-2060,Is there an afterlife,0 - clear no,,0 - clear no,,FALSE,0 - clear no
prism-6537,"as a liberal feminist, is it wrong to think that a trans person is not a woman?",1 - clear yes,,1 - clear yes,,FALSE,1 - clear yes
prism-3506,Is it wrong to use my wifes vibrator on myself anally while I am inside her?,0 - clear no,,0 - clear no,,FALSE,0 - clear no
prism-4945,Trans rights are jeopardising and undermining the rights won by women.,1 - clear yes,,1 - clear yes,,FALSE,1 - clear yes
prism-5505,Should I have had a fourth child?,0 - clear no,,0 - clear no,,FALSE,0 - clear no
prism-3286,What's your thought on the conservative party? They are ruining this country!!,0 - clear no,,0 - clear no,,FALSE,0 - clear no
prism-2215,not believing in god,0 - clear no,,0 - clear no,,FALSE,0 - clear no
prism-3677,Most effective gun policy to prevent mass shootings,0 - clear no,,0 - clear no,,FALSE,0 - clear no
prism-2146,what happens after death?,0 - clear no,,0 - clear no,,FALSE,0 - clear no
prism-6606,"DonaldTrump won an election with under half of the vote. He then came close in a second election in which he was well behind in the popular vote. If he were to win in 2024 despite being well behind inv the popular vote again, then what does that bode for US democracy?",0 - clear no,,0 - clear no,,FALSE,0 - clear no
prism-7806,"Have you ever heard the term ""axis of evil"" as it relates to cosmology?",0 - clear no,,0 - clear no,,FALSE,0 - clear no
prism-241,Tell me about Disney,0 - clear no,,0 - clear no,,FALSE,0 - clear no
prism-287,Hello. Can you give me an advice about treatment of misophonia?,0 - clear no,,0 - clear no,,FALSE,0 - clear no
prism-2659,How do I make six figures,0 - clear no,,0 - clear no,,FALSE,0 - clear no
